Journal Code,Unified Command,Region,Province,Type of Engagement,Reference,Report RN,Date,Summary Report,Enemy Side,Government Side,Civilian Side,Firearms Gained,Firearms Losses,Items Recovered / Loss,Other Details,Action Taken,
11003,EASTMINCOM ,REGION XI,DAVAO DEL NORTE  ,SHOOTING,EASTMINCOM ,EMCOC-0109-569-10 ,01 Sep 2010,"On 010100 Sep 2010, Sgt Warlito H Hopita 77989 PA was shot at vicinity Menzi, Poblacion, Sto Tomas, Davao del Norte by four civillian identified as Samuel Costales, Ariel Biongan, Leo Palacio and Marvin Bustillo.Other Details:",,,,,,,Accordingly the victim sustained gunshot wounds in his neck & in the left portion of the chest. The victim was immediately rushed to Rivera Hospital in Panabo City but was declared dead on arrival (DOA) by the attending physician.,Suspects were apprehended and now detained at PNP Sto Tomas for proper disposition and filing of appropriate case.,
11006,EASTMINCOM ,REGION XI,CARMEN ,SHOOTING,EASTMINCOM ,EMCOC-0109-574-10 ,02 Sep 2010,"On 02 Sep 2010, a certain Noli Javier Bagay  was shot to death by CAA Jhonny T Bañez DS G-900034 at vicinity Purok 4, Bgy Tuganay, Carmen, Davao del Norte using Cal. 22 revolver. Said CAA is presently assigned at Tubison PB, ECoy, 72IB, So Tubison Bgy Astorga, Sta Cruz, Davao del Sur.Other Details:",,,,,,,"The incident transpired when the subject CAA and the victim were having drinking spree and later have a heated argument which resulted to the said incident. The victim sustained gunshot wounds at his upper right back, upper left leg and right palm that caused his instantaneous death.",CAA Bañez was apprehended and presently detained,
11011,EASTMINCOM ,REGION XII,COTABATO  ,DEATH BY NATURAL CAUSES,6ID ,6DTOC-0209-05-2010 ,02 Sep 2010,"On 020220 Sep 2010, CAA Jade S Cabangisan CO-G06-000021, assigned at Pagangan II Detachment, 11th NC CAA Coy, 38IB was declared dead on arrival (DOA) by his attending physician due to cardiac arrest at Aleosan District Hospital.Other Details:",,,,,,,"The remains of said CAA now lies in state at their residence at Brgy Mampurok, Aleosan, Cotabato.",,
11012,EASTMINCOM ,REGION XII,COTABATO  ,VEHICULAR ACCIDENT,6ID ,6DTOC-0209-04-2010 ,02 Sep 2010,"On 02 Sep 2010, CAA Gembong D Torquiza CO-GO6-000110 assigned at Hqs 9TH NC CAA Coy OPCON to BCoy, 38IB, PA met an accident while riding his single motorcycle HONDA XRM with plate number 6244 at vicinity Brgy Marbel, Matalam, Cotabato.Other Details:",,,,,,,Subject CAA suffered serious physical injuries and was brought to Davao Doctors Hospital.,,
11013,EASTMINCOM ,ARMM,COTABATO  ,DEATH BY NATURAL CAUSES,6ID ,6DTOC-0209-2010 ,02 Sep 2010,"On 01 Sep 2010, CAA Detay L Manguason NC A004027 presently assigned at Aroman Detachment, 33th NC CAA Coy, BCoy, 39IB was hacked to death using a jungle bolo by a certain Rey Pontungan at vicinity Brgy Bentangan, Carmen, Cotabato. The victim suffered a hacked wound on his neck that caused his instanteneous death.Other Details:",,,,,,,The suspect and victim were under the influence of liquor and have a heated argument before the incident.,The suspect voluntarily surrendered to the chairman of said brgy and was subsequently turned over to Carmen PNP.,
11014,EASTMINCOM ,CARAGA,AGUSAN DEL SUR ,SHOOTING,4ID ,OPN-0209-1675-10 ,02 Sep 2010,"On 31 Aug 2010, CAA Jemar Recaplaza of BCoy, 23IB, 4ID, PA while conducting inventory of his Falcata Logs was shot to death by four unidentified gunmen believed to be members of CTs under GF19A under @Ado (TNU) and @ Ilay (TNU) at vicinity P-4, Brgy Mabuhay, Prosperidad, Agusan del Sur. Afterwhich, the perpetrators immediately withdrew towards Brgy Magsaysay of same municipality.Other Details:",,,,,,,The victim suffered a gunshot wound on his head that caused his instantaneous death.,,
11018,EASTMINCOM ,ARMM,MAGUINDANAO  ,ACCIDENTAL FIRING,6ID ,6DTOC-0309-05-2010 ,03 Sep 2010,"On 02 Sep 2010, Pfc Ryan G De Dios 843980 (Inf) PA of BCoy, 29IB, PA while inside his bunker accidentally kicked his service FA (K3 SAW) causing the weapon to fire and accidentally hitting his chest that caused his instantaneous death at vicinity Brgy Buayan, Datu Piang, Maguindanao.Government Side:",,KIA Pfc Ryan G De Dios 843980 ,,,,,,"1LT ORCULLO PA, OIC CCoy, 29IB immediately coordinated with the PNP for further investigation.",
11022,EASTMINCOM ,REGION X,BUKIDNON  ,APPREHENSION,4ID ,OPN-0309-1678-2010 ,03 Sep 2010,"On 01 Sep 2010, One (1) squad of CAA from Kalagangan PB led by Sgt Penuel T Angus (Inf) PA responded to the request of Brgy Kagawad Uy, designated Brgy Peace and Order Councilor, on the alleged indiscriminate firing at his house. The troops apprehended a certain Jetrun Olavides, 20 years old and resident of Brgy San Vicente, Baungon, Bukidnon and recovered from his possession - one (1) home made shotgun (SN: defaced) with two (2) live ammos.Action Taken:",,,,,,,,"The suspect with his firearm was turned over to PNP Baungon, Bukidnon for filing of appropriate charges.",
11033,EASTMINCOM ,ARMM,MAGUINDANAO  ,STONING,"6ID, PA ",CN 6DTOC-0409-09-2010 ,04 Sep 2010,"On 031015 Sep 2010, CAA Arturo P Laureano MG-C000042, 55 y/o, married, resident of Sitio Bliss, Brgy Nituan, Parang, Maguindanao and presently assigned with H14 Maguindanao CAA Coy, Brgy Pinantao, Parang, Maguindanao (off duty) while rendering security duty to a Pannel Van of Tanduay for his extra income was stoned by unidentified suspect at Public Market, Parang, Maguindanao.Other Details:",,,,,,,"Said CAA was hit on his head and was brought by civilian to Puerlculture Center and Hospital, Parang, Maguindanao for medical treatment.","At about same day, one (1) team of CAA Coy led by Cpl Jose Millan (Inf) PA, CAA F/Sgt proceeded to the crime scene to track down the suspect while the victim is now in stable condition.",
11041,EASTMINCOM ,REGION X,LANAO DEL NORTE  ,DEATH BY NATURAL CAUSES,"6ID, PA ",CN 6DTOC-0509-12-2010 ,05 Sep 2010,"On 051600 Sep 2010, Pvt Bienne B Genayas 882745 was killed by two (2) unidentified person at Purok 1, Brgy Bosque, Linamon, Lanao del Norte, using a sickle.  Subject EP suffered fatal wounds on the different parts of his body that causing his instataneous death.Government Side:",,KIA Pvt Bienne B Genayas 882745 ,,,,,,,
11056,EASTMINCOM ,ARMM,MAGUINDANAO  ,DEATH BY NATURAL CAUSES,6ID ,CN 6DTOC-0709-20-2010 ,07 Sep 2010,"On 07 Sep 2010, SCAA Bimbo G Tambungalan MG-GO3-000322, 31 yrs old, married member of 6th MG SCAA Coy based at Paglat, Maguindanao under CCoy, 38IB died at his residence at Brgy Poblacion, Paglat, Maguindanao due to his complicated illness.Other Details:",,,,,,,Next of kin: Farida M Tambungalan (wife).,Cadaver of said SCAA lay in the state at his residence for proper disposition.,
11061,EASTMINCOM ,REGION XII,NORTH COTABATO ,DEATH BY NATURAL CAUSES,6ID ,6DTOC-0809-26-2010 ,08 Sep 2010,"On 071918 Sep 2010, a certain CAA Edgardo S Neniel NC-A001901 assigned at Balabag Detachment, 26th NC CAA Coy, GCoy, 38IB, PA died at his residence at Sitio Maweg, Brgy Balabag, Kidapawan City due to goiter cancer/laryn geal carcinoma.Other Details:",,,,,,,Next of skin - Mrs Rosalina R Neniel (wife).,The remains of said CAA lies in state at his residence.,
11080,EASTMINCOM ,CARAGA,SURIGAO DEL SUR  ,VEHICULAR ACCIDENT,4ID ,OPN-0909-1122-2010 ,09 Sep 2010,"On 06 Sep 2010, 1LT SANJIE B SANGATANAN O-14226 (INF) PA of 75IB while onboard Kawasaki motorcycle traversing the main road from Brgy Mangagoy, Bislig City accidentally crashed at vic Bay walk park, Bislig City, Surigao del Sur.",,,,,,,,,
11081,EASTMINCOM ,CARAGA,SURIGAO DEL SUR  ,DEATH BY NATURAL CAUSES,4ID ,OPN-1009-1726-2010 ,10 Sep 2010,"On 09 Sep 2010, CAA Florante R Beberino AS-A005101 of 12th Surigao del Sur CAA Coy, 23IB, PA died due to to diabetes and kidney failure at his residence at Brgy Sibaroy, Bislig City, Surigao del Sur.Other Details:",,,,,,,The cadaver of said CAA lies at his residence. ,,
11099,EASTMINCOM ,REGION XII,SOUTH COTABATO  ,VEHICULAR ACCIDENT,"6ID, PA ",6N 6DTOC-1109-37-2010 ,11 Sep 2010,"On 102044 Sep 2010, A certain CAA Leysa of 16th SK CAAC, assigned at Bagras Det, DCoy, 38IB while traversing along Koronadal City - General Santos City Nat`l highway onboard his passenger tricycle with his family was accidentally bumped by a pick up truck, color red and bearing plate number LDR 933 at vicinity Brgy Kablon, Tupi, South Cotabato. Accordingly, CAA Leysa and his family left their residence at Purok Dhalia, Sitio Manirub, Brgy Pamatingan, Esperanza, SK at about 1500H of same day to attend baptismal ceremony of his nephew at Polomolok South Cotabato.Government Side:",,KIA CAA Irin L Leysa SK-A 002577 ,Died Ms Nicky Mae Leysa Ms Nicole Joy Leysa Injured Ms Chita Leysa Mr Jhonly Mar Leysa Mr Joefrrey Leysa Mr Nickson  Leysa Mr Ronnie Leysa,,,,"Nicole Joy, 8 y/o, daughter of said CAA died on the spot, while CAA Leysa and Nicky Mae, 13 y/o also his older daughter died at Saint Elizabeth Hospital, Gen Santos City while undergoing treatment threat. Nickson, son of CAA Leysa and his relatives Chita, Ronnie, Jhonly Mar and Jeofrrey sustained serious injuries.Next of kin: Mrs Cherryl P Leysa - wife.",The remains of late CAA Irin and his two (2) daughter laid at Saint Elizabeth Hospital for funeral rites.,
11105,EASTMINCOM ,REGION XI,COMPOSTELA VALLEY  ,SHOOTING,EASTMINCOM ,EMCOC-1209-670-10 ,12 Sep 2010,"On 112200 Sep 2010, a shooting incident transpired at vicinity Brgy Melale, Laak, Compostela Valley. Accordingly, Pfc Dela Torre (Inf) PA, Asst Cadre of Melale PB and Pfc Nicolas (Inf) PA of 8SFC, 3SFB while at the vicinity of PNP Outpost at the said Brgy. A civilian volunteer identified as Jonathan Arellano, 35 y/o, married, a resident of Purok 1, Brgy Melale, Laak, Compostela Valley approached them and without apparent reason shot them twice using 12 gauge shotgun.Government Side:",,KIA Pfc Robert N Dela Torre 841292  WIA Pfc Jhonmar P Nicolas 866920 ,,,,,"Pfc Dela Torre suffered gunshot wound while Pfc Nicolas was also hit at his left leg. Immediately, the victims were brought to Laak Municipality Hospital, Laak, Compostela Valley but unfortunately, Pfc Dela Torre (Inf) PA declared dead on arrival (DOA) by the attending physician while Pfc Nicolas (Inf) PA is still at the Hospital for medical treatment.","At about 120600H Sep 2010, LTC PANIZA, Commander of 72IB and CPT SACLOT PA, Bn S2 proceeded to the area to invistigate.",
11116,EASTMINCOM ,REGION XI,COMPOSTELA VALLEY ,SHOOTING,EASTMINCOM ,EMCOC-1309-675-10 ,14 Sep 2010,"Progress Report to Journal Item Nr: 11105 dtd 13 Sept 10, re-shooting incident at Brgy Melale, Laak, CVP, involving Pfc Robert N Dela Torre 841292 (Inf) PA and Pfc Jhonmar P Nicolas 866920 (Inf) PA on 112200H Sept 2010.Other Details:",,,,,,,"a. Pfc Dela Torre PA and Pfc Nicolas PA were immediately rushed to Laak Municipal Hospital for medical treatment but Pfc Dela Torre PA was pronounce dead on arrival (DOA) by the attending physician.  b. On 110900 Sept 10, Pfc Jhonmar Nicolas PA of 9SFBn, 3SFBn augmented to Melale PB had a drinking spree at a nearby Evilia Store (200 meters away from Melale PB). On 1700H same day, he went back to the PB & took his dinner afterwhich, he went back to the store for another drinking session, however the store owner refused to grant him as he was already drunk. c. On 2200H same day, he went to the PB and woke-up Pfc Robert M Dela Torre PA and informed that his Cal .45 pistol was confiscated at the PNP outpost. Hence, Pfc Dela Torre PA with three (3) other unarmed CAAs accompanied Pfc Nicolas PA to the said outpost to recovered the pistol and was found out that it was not confiscated by the PNP instead it was left at the store where he drink. The pistol was turned-over to Pfc Dela Torre PA as he checked the chamber it accidentally fired at the ground. No one was harmed during the incident but still Pfc Dela Torre PA asked apology to the PNP personnel afterwhich, they asked permission to go back to Melale PB. When they leaved the outpost, suddenly a CVO identified as certain Jonathan Arellano, 35 yrs old, approached them from behind and without apparent reason shot them twice using a 12 gauge shotgun. Pfc Dela Torre PA suffered wounds at the hips and back while Pfc Nicolas Pa suffered wounds at his left leg. SPO4 Ponteras responded and was able to confiscated the firearm used but the suspect who managed to escape. ","a. On 120800H Sept 2010, PSI Dampac, COP, Laak together with PNP SOCO arrived at the crime scene & conducted investigation and later conferred with Comdr, 72IB and Comdr 9SFC for the filling of appropriate charges and possible apprehension of the suspect. b. On 0900 same day, cadaver of late Pfc Dela Torre was brought to Villa Homes in Panabo City for proper disposition.",
11117,EASTMINCOM ,REGION XII,SARANGANI  ,VEHICULAR ACCIDENT,EASTMINCOM ,EMCOC-1309-676-10 ,13 Sep 2010,"On 122100 Sep 2010, Cpl Edgar F Revelo 794082 (Inf) PA, HHCOY, 73IB onboard his motorcycle from Bn HQs going to Sequil checkpoint, SO Sequil, Brgy Tinoto, Maasim, SP was bumped (hit and run) by a saddam truck along the national highway of Brgy Kamanga, Maasim, SP going to Pob Maasim, SP. The victim was immediately brought to Maasim Hospital for immediate medication but was declared dead on arrival (DOA) by the attending physician.Action Taken:",,,,,,,,"a. At about 2110H same day, 1LT DUAZO, S2, 73IB conducted mobile patrol. b. C/73IB & all PBs including BDF conducted checkpoint to intercept the perpetrator. c. At about 2205H same day, the above-mentioned saddam truck which bumped (hit and run)  Cpl Revelo PA was intercepted in a checkpoint along Kitaga TPB, Brgy Katubao, Kiamba, SP. Said vehicle bearing plate number MDT 781 driven by Mr Joseph P Benito. The driver together with the saddam truck were brought to Maasim PNP station for proper disposition.",
11139,EASTMINCOM ,REGION XII,COTABATO ,SHOOTING,"6ID, PA ",6DTOC-1609-47-2010 ,16 Sep 2010,"On 161730 Sep 2010, Passengers of red colored  Toyota Town Ace were shot by two (2) unidentified suspects astride a motorcycle  in front of Grace Pharmacy near Cotabato Regional and Medical Center (CRMC) along Sinsuat Ave, Brgy Rosary Heights-9, Cotabato City. The suspects fled the area immediately.  Other Details:",,,,,,,a. The victims were identified as follows:  1.Bailyn Bandila Blah  2.Zaudin Moson  3.Antonio Lubaya Masukat  4.Florence De Roma  5.Lalyn Antipuesto  b.They were immediately brought to Cotabato Regional Hospital and Medical Center (CRMC) for medical treatment but Bailyn Bandila Blah was declared dead on arrival (DOA) by the attending physician. Motive of the incident could not be ascertained as of this report.,"a.One (1) team from ORG Det, TG Tugis led by Msg Palubon PA, responded to said incident and conducted pursuit operations against the suspects but yielded negative result. b. TG Tugi operatives conducted initial investigation. ",
11140,EASTMINCOM ,REGION XII,COTABATO CITY ,SHOOTING,"6ID, PA ",6DTOC-1609-46-2010 ,16 Sep 2010,"On 161720 Sep 2010, a certain Arsib Ibrahim Pasigan of legal age, married, resident of Crossing Pinaring, Brgy Limbo, Sultan Kudarat, Maguindanao was shot  by a certain Castro K Ismael, 26 yrs old, single, tricycle driver, a resident and Tanod of Brgy Rosary Heights-3, Cotabato City at Arsheed Cafeteria located along Sinsuat Ave, Brgy Pob-5, Cotabato City. The victim sustained gsw on the right portion of his head causing his instantaneous death.Firearms Gains:",,,,Recovered 1 - Cal .45 pistol (sn: 374281),,Recovered 1 - Empty shell for Cal .45 pistol,.,The suspect was brought to Cot City Police Station #1 for investigation while the recovered firearm was brought to HTG Tugis and later turned-over to Police Station #1 for proper disposition. Motive of the incident is believed to be personal grudge.,
11141,EASTMINCOM ,REGION XII,COTABATO ,ENCOUNTER,"6ID, PA ",6DTOC-1609-48-2010 ,16 Sep 2010,"On 161530 Sep 2010, one (1) team from Polomoguin Det led by Cpl Endalia (Inf) PA, encountered while conducting check point operations encuntered unidentified men at Purok Mirasol, Brgy Polomoguin, Midsayap, Cotabato. The incident was the result of the hold-up incident transpired at Poblacion, Midsayap, Cotabato, perpetrated by the same unidentified armed group onboard one (1) L300 Van. Other Details:",,,,,,,.,.,
11142,EASTMINCOM ,CARAGA,SURIGAO DEL NORTE ,DEATH BY NATURAL CAUSES,"4ID, PA ",OPN-1609-1759-2010 ,16 Sep 2010,"On 150930 Sep 2010, CAA Encosentes B Dalubatan SN-GO8-000035, 7th Surigao del Norte CAA Coy presently assigned at Silop PB of ECoy 23IB, 4IB, PA died due to hypertension and pulmonary bronchitis. The said of said CAA lies at his at Brgy Paco, Mainit, Surigao del Norte. Other Details:",,,,,,,Beneficiary of subject CAA is Mrs Nelma O Dalubatan-Wife.,,
11145,EASTMINCOM ,REGION XI,COMPOSTELA VALLEY  ,VEHICULAR ACCIDENT,EASTMINCOM ,EMCOC-1609-691-10 ,16 Sep 2010,"On 16 Sep 2010, a vehicular accident transpired at Brgy Manat, Nabunturan, CVP involving one (1) cruiser jeep of 72nd IB and a privately owned Saddam Truck.Accordingly, said vehicle is traversing the Brgy Manat road going to Tindalo PB, Mrgy Mainit, Nabunturan, CVP was accidentally hit by the truck which caused injury to MAJ PAYOT and CAA Ariston A Baliguat in the different parts of their bodies. Injured personnel were immediately brought to Nabunturan Doctors Hospital and further evacuated to Davao Regional Hospital, Tagum City Action Taken:",,,,,,,,The driver was turn over to Nabunturan Police Station for proper investigation and filling of appropriate charges.,
11157,EASTMINCOM ,REGION XII,SULTAN KUDARAT  ,RECOVERY OF IED,EASTMINCOM ,EMCOC-1809-700-10 ,18 Sep 2010,"On 18 Sep 2010, Intel NCO of 33IB received an info thru cellphone fm informant that Mosanif Solaiman @ Adan Abdullah, Base Comdr, 106th BC, BIAF, MILF & Ampatuan Pags leader Banarin Ampatuan @ Datu Ban instructed unident person to plant a bomb in Tacurong City. Unfortunately, due to sustained military checkpoint  operations, said IED was abandoned by the courier at vicinity Brgy Tuato, President Quirino, Sultan Kudarat.Action Taken:",,,,,,,,"AA 002011 SD, said IED was defused bt the personnel of 65EODT with no untoward incident.",
11169,EASTMINCOM ,CARAGA,AGUSAN DEL SUR ,SHOOTING,"4ID, PA ",OPN-1809-1772-2010 ,19 Sep 2010,"On 13 Sep 2010, CAA Melanio U Taan Jr SN-G08-000077 of 11th ADN CAA Coy assigned at Pangaylan Patol Base of GCoy, 23CBn was shot to death by unidentified person using unknown type to firearm at vic Sitio Bayabas, Brgy San Isidro, Santiago, Agusan del Norte.Other Details:",,,,,,,The victim suffered two (2) gunshot wounds on his head that caused his instantaneous death. Motive of the killing is still being determined.,"a. The remains of late CAA Taan Jr was brought at his residence at Brgy Poblacion 1, Santiago, ADN. b. On 150730 Sep 2010, one (1) squad of CAA from GCoy, 23CBn led by 1LT MAULANA B DITUAL (AGS) PA Co, GCoy, 23CBn, 4ID, PA on board Lite Ace vehicle left Coy CP and proceeded towards Pangaylan PB to verify and investigate the shooting incident.",
11178,EASTMINCOM ,REGION XII,SULTAN KUDARAT ,DEATH BY NATURAL CAUSES,"6ID, PA ",6DTOC-1709-56-2010 ,20 Sep 2010,"On 191700 Sep 2010, CAA Reynaldo C Roquero Sr SK-G04-000007 PA, 50 years old, married, a resident of Brgy Kalandagan, Tacurong City, Sultan Kudarat and presently assigned with Hqs 2nd SK CAA Coy based at Brgy Kalandagan, Tacurong City under CCoy, 38IB died at his residence due to complicated illness. Other Details:",,,,,,,The remains of said CAA lies at his residence.Next of kin: Mrs Juvy Canta Roquero (Wife).,,
11187,EASTMINCOM ,REGION XII,NORTH COTABATO ,SHOOTING,EASTMINCOM ,EMCOC-2019-713-10 ,21 Sep 2010,"On 20 Sep 2010, a certain Alonto Bangkulit Sr of Datu Montawal, Maguindanao and a municipal treasurer of Pagalungan, Maguindanao was shot by an unidentified suspect using a Cal .45 pistol as per recovered empty shells in the crime scene at vicinity USM Ave. Kabacan, North Cotabato. The victim suffered multpile GSW in the different parts of his body. Other Details:",,,,,,,Suspect immediately fled to unknown direction.,Intel Operatives/7th IB/602nd Bde responded and conducted initial investigation for possible identification of the suspect. Victim was rushed to Kabacan Med Specialist. PNP Kabacan is now investing the case.,
11192,EASTMINCOM ,ARMM,MAGUINDANAO ,SHOOTING,EASTMINCOM ,EMCOC-2109-718-10 ,21 Sep 2010,"On 211400 Sep 2010, a ceratin Hadji Tander Abubakar, married, 39 yrs old, was shot twice by unidentified gun man using Cal .45 pistol at his business establisment at vicinity RTW Parang Public Market, Pob 2, Parang, Maguindanao. The suspect fled away towards unknown direction. The victim was rushed to Cotabato Regional and Medical Center (CRMC) but declared DOA by the attending Physician. Motives unknown.",,,,,,,,,
11193,EASTMINCOM ,REGION XII,COTABATO ,FRACTURED FOREARM,EASTMINCOM ,EMCOC-2109-717-10 ,21 Sep 2010,"On 201600 Sep 2010, Pfc June A Panaguiton 869057 (Inf) together with Pfc Minlaud PA, Pfc Elec and Pfc Petalco PA, all combat operation (CBO) operators of HHSVCot, 57IB station at Brgy Indangan, Makilala, Cotabato while playing basketball at Indangan Basketball Court to maintain physical conditioning, Pfc Panaguiton accidentally fall to the ground that caused fractured of his left forearm.Action Taken:",,,,,,,,"The troops applied first aid and immediately brought subject EP to Medical Specialist Hospital, Kidapawan City for medical treatment.",
11194,EASTMINCOM ,ARMM,MAGUINDANAO ,ARMED CLASH,EASTMINCOM ,EMCOC-2109-716-10 ,22 Sep 2010,"On 220615 Sep 2010, Brgy Chairman Kamid Mamalinta of Brgy Lepak, Pandag, Maguindanao and Brgy Councilor Edwin Mamalinta with MOL 30 followers, encountered the armed group of a certain Kedzis Mamalinta at vicinity Brgy Lepak, Pandag, Maguindanao. Heavy gunfire exchange lasted for about fifteen (15) minutes afterwich, the group of Kedzis Mamalinta withdrew towards Brgy Palao Sa Buto, Datu Paglas of same Province. No reported casualty on both sides.  Other Details:",,,,,,,"Accordingly, the root cause of their conflict is the killing of Chairman Kamid Mamalinta`s son sometimes 2007 by the group of Kedzis Mamalinta & a certain Abusama Mamalinta of 109th BC, BIAF, MILF. Chairman Kamid and Kedzis is closed relatives and both reside in the area.",,
11202,EASTMINCOM ,ARMM,MAGUINDANAO ,SHOOTING,"6ID, PA ",6DTOC-220965-2010 ,22 Sep 2010,"On 211830 Sep 2010, a certain Dadtungan M Ayada, 40 yrs old, together with his wife Sheilah Ayada, 38 yrs old and children Farideah, 10 yrs old and Fahadelou, 7 yrs old, residents of Brgy Madidis, Datu Paglas, Maguindanao, onboard a white KIA vehicle with plate Nr LFK 914 from Tacurong City heading towards their residence were shot  at by two (2) unidentified persons onboard colored black DT single motorcycle with unknown plate number using M16 rifle.Other Details:",,,,,,,"a. Dadtungan M Ayada sustained GSW on the left side of his neck that caused his instantaneous death while his wife and children were unharmed. b. Investigation conducted by 33IB revealed that the victim has  personal grudge with Yusoph Kusain @TMX, KFRG alleged Bde Comdr, 108BC and Amino Nandu, former Base Comdr of 109BC for not agreeing to give one (1) sack of rice per hectare every harvest of their 120 hectare rice field at Brgy Madidis. c. The clan has also political grudge with the Municipal Mayor of Datu Paglas for they are Mangudadatu supporters. The case is under investigation by Pandag PNP while intel operatives of same unit were tasked to identify the perpetrators.","One (1) team from 3rd Mag SCAA Coy led by Sgt Canlo PA proceeded to the crime scene but the perpetrators already withdrew to unknown direction. The cadaver of the victim was brought to their residence, Motive is personal grudge.",
11216,EASTMINCOM ,ARMM,MAGUINDANAO  ,ABDUCTION,EASTMINCOM ,EMCOC-2309-736-10 ,23 Sep 2010,"On 230730 Sep 2010, two (2) passenger vehicles (Toyota Revo with plate nr XCX 590, color blue and Isuzu Crosswind with plate nr XCP 886 color green) coming from Davao proceeding towards Marawi City, were flagged down at vicinity near the former CAA Det, Bayanga Norte, Matanog, Maguindanao by MOL 15 armed men under a certain Bassit Kasanguan and Joel Kasanguan. The armed men ordered the driver to hide at the forested area of said brgy and ordered all passengers to dismount. They took with them seven (7) unidentified male passengers and proceeded towards Sitio Kirudan Bayanga Norte, Matanog, Maguindanao, while the remaining passengers were released. All of the seven (7) abducted passengers are Maranaos and residents of Marawi City.  Other Details:",,,,,,,"Motive of the incident is believed to be retaliation of the family of a certain Aris D Lidasan, resident of So Sarakan, Brgy Bugasan Norte, Matanog, Maguindanao who was abducted last 13 Sept 2010 at Lumba Bayabao, Lanao del Sur.","Troops are in pursuit operations. Coordination and consultation is going on, at 51IB, 1ID, PA. ",
11225,EASTMINCOM ,REGION XI,COMPOSTELA VALLEY ,DEATH BY NATURAL CAUSES,EASTMINCOM ,EMCOC-2409-674-10 ,24 Sep 2010,"On 240818 Sep 2010, CAA Quilloza DN-G05-000122 Died at Davao Medical Center (DMC), Bajada, Davao City due to Cardio Pulmonary Arrest. Subject is presently at Osmeña PB, 15th CVP CAA Coy, ACoy, 72IB, stationed at Brgy Osmeña, Compostela, CVP.Other Details:",,,,,,,"The remains of said kaa lie at Montoya Funeral Homes, Nabunturan, CVP. Next of kin: Mr Bienvinido Mahina (Grandfather)",,
