Journal Code,Unified Command,Region,Province,Type of Engagement,Reference,Report RN,Date,Summary Report,Enemy Side,Government Side,Civilian Side,Firearms Gained,Firearms Losses,Items Recovered / Loss,Other Details,Action Taken,
11125,EASTMINCOM ,REGION XII,NORTH COTABATO ,HARASSMENT,"6ID, PA ",6DTOC-1509-42-2010 ,15 Sep 2010,"On 15 Sep 2010, undetermined number of fully armed CTs under Comdr Emmanuel Fernandez @ Bobo, CO, ROC, FSMR harassed the Wardog/Lamsol Banana Plantation located at vicinity Sitio Saban , Brgy Kanibong, Tulunan, North Cotabato.Other Details:",,,,,,,"Said CTs disarmed the duty security guard and told the civilian workers of the said plantation to leave the area because they are not being compensated by ex-governor Manny Piñol. The CTs burned the building of  palletizing equipment and storage facility and brought along with them some properties that they could use. Afterwhich, they fired indiscriminately to terrorize and intimidate the civilian populace in the area and withdrew towards Sitio Blat, Brgy Bacung of the same municipality. No civilian casualty was reported. ",,
11128,EASTMINCOM ,REGION XI,DAVAO DEL NORTE ,SHOOTING,EASTMINCOM ,EMCOC-1509-680-10 ,16 Sep 2010,"On 142100 Sep 2010, CAA Renante F Ramos DN-A004446 and CAA Bonifacio D Abonero DN-A004171 of Mambing PB stationed in Brgy Mambing, New Corella, DDN under DCoy, 72CBn, 10ID, PA while on their way home from attending a fiesta celebration were shot by three (3) SPARU members of GF33, SMRC using Cal .45 pistol at vicinity Sitio Bucaran, Brgy Sta Fe, New Corella, Davao del Norte. One (1) of the suspects was identified as certain Joey Coquillas  Government Side:",,WIA CAA Renante F Ramos   ,,,,,"CAA Ramos suffered gunshot wound at his neck and was immediately brought to Davao Regional Hospital, Tagum City for medical treatment.","Intel operatives of 72IB, 10ID, PA were tasked to monitor the whereabouts and possible apprehension of the suspects.",
11137,EASTMINCOM ,REGION XII,NORTH COTABATO ,HARASSMENT,"6ID, PA ",6DTOC-1609-44-2010 ,16 Sep 2010,"Progress Report to Journal Item Nr: 11125 dtd 15 Sept 2010, re-harassment of Agriculture Venture Incorporated by MOL 50 CTs under Emmanuel Fernandez @BOBO, CO, ROC, FSMR at Sitio Saban, Brgy Kanibong, Tulunan, NCot on 150900 Sept 2010. Other Details:",,,,,,,"a. The CTs burned one (1) palletizing house, one (1) warehouse containing fertilizer and other chemical, two (2) container vans with empty cartons, one (1) Tractor, and one (1) Canter Truck with a total estimated cost of Two Million Five Hundred Thousand Pesos (P2,500,000.00).  b. The CTs also carted one (1) M16 rifle, one (1) Carbine rifle, eight (8) Homemade 12 Guage Shotgun, and two (2) Handheld Radios belong to the security personnel of the said establishment. c. The perpetrators withdrew towards Sitio Blad, Brgy Bacung, Tulunan, NCot. Negative casualties reported. The CTs distributed an open letter to the populace stating the reason why they staged the attack. Allegedly, the employees of the said company complained for not recieving proper compensation and that Ex-Gov Manny Piñol grabbed the lands from its real owners.",Three (3) sections of 68IB conducted clearing operations in the area and still ongoing.,
11143,EASTMINCOM ,REGION XI,COMPOSTELA VALLEY ,BURNING,ISAFP ,STL DTD 17 SEPT 10 ,17 Sep 2010,"On 162130 Sep 2010, the staff house of Tigre de Oro mining owned by a certain Mr Lim located in Brgy Dumla, Maco, Compostela Valley Province was burned down by MOL 15 fully armed CTs belonging to GF-2, SMRC led CTL @BENAL (TN: Vicente Taoy), Sec, GF-2, SMRC. Other Details:",,,,,,,The incident may be due to the management`s failure to provide the CT`s their demanded amount.,,
11148,EASTMINCOM ,REGION XII,SARANGANI  ,DISCOVERY OF ENEMY CAMP,EASTMINCOM ,EMCOC-1709-696-10 ,17 Sep 2010,"On 171600 Sep 2010, PLTN (-) of ACoy, 73IB under 2LT URSUA while acting upon a bdf information of enemy presence, discovered a newly abandoned enemy harboring site at vicinity Sitio Mangga, Brgy Datal Angas, Alabel, Sarangani Province.Items Recovered / Loss: ",,,,,,Recovered 1 - notebook with enemy information 1 - pair boots with socks 1 - pouch of rice 1 - sweatshirt 1 - t-shirt 1 - transistor radio,,Troops have reconnoitered the area and preserved enemy left behind articles.,
11155,EASTMINCOM ,REGION XI,DAVAO DEL SUR  ,ENCOUNTER,EASTMINCOM ,EMCOC-1709-692-2010 ,18 Sep 2010,"On 17 Sep 2010, a section of 3rd Pltn,Coy, 39IB., 10ID, PA under 2LT PACLEB encountered  more or less ten (10) CTs from PLTN MAZDA, GF - 71, FSMR at vicinity Sitio Lalon 1, Brgy Little Baguio, Malita, Davao del Sur. Firefight lasted for about five (5) minutes. Afterwhich, the enemy withdrew towards unknown direction. No casualty was reported on either side. Other Details:",,,,,,,The LE withdrew to Sitio Upper Kiapok of same Brgy. Negative casualty reported.,Troops conducted pursuit operations to the fleeing CTs.,
11172,EASTMINCOM ,REGION XII,NORTH COTABATO ,HARASSMENT,EASTMINCOM ,EMCOC-1909-703-10 ,20 Sep 2010,"On 19 Sep 2010, Bacong Detachment of 4th NC CAA Coy, GCoy, 38IB, 6ID, PA led by SSg Ermelito Ladan (Inf) PA was harassed by undetermined number of CTs at vicinity Brgy Bacong (51N YH 223533), Tulunan, North Cotabato.Other Details:",,,,,,,The enemy positioned at 400 mtrs Northwest of the said detachment.,"Troops returned fire towards the enemy position. Firefight lasted for about tweenty (20) minutes, afterwhich, the enemy withdrew towards southwest direction. No casualty was reported on either side.",
11173,EASTMINCOM ,REGION XII,SARANGANI PROVINCE ,RESCUE OPERATIONS,EASTMINCOM ,EMCOC-1909-705-10 ,20 Sep 2010,"On 18 Sep 2010, a minor identified as Jojo Taje was rescued by the operating troops of 73IB, 10ID, PA led by 2LT CABALES PA particularly the squad under SSg Maraño PA at vicinity Sitio Kisoy (51N YG 759847), Brgy Datal Anggas, Alabel, Sarangani Province.Other Details:",,,,,,,"Accordingly, said minor was utilized by the CTs as their guide. Prior to the incident, members of Pltn Mazda under GF71 were sighted at the vicinity of the abovementioned barangay.",Rescued minor was turned over to his family while operating troops and K9 Team are still scouring and tracking the area for possible enemy presence.,
11184,EASTMINCOM ,CARAGA,AGUSAN DEL SUR ,HARASSMENT,"4ID, PA ",NR-2009-1777-2010 ,20 Sep 2010,"On 200530 Sep 2010, Mafil PB of 16th ADS CAA coy of CCoy, 23IB under Sgt Patrick L Abuhon 731389 (inf) PA based in Marfil, Rosario, Agusan del Sur was fired upon with four (4) rounds of unknown FA by four (4) armed CTs under @TATA of SECON 14, NEMR. After which, the enemy withdrew towards the forested area of Sitio Latay of same Brgy. Negative casualty on the gov`t side.",,,,,,,,,
11186,EASTMINCOM ,REGION XII,SARANGGANI  ,ENCOUNTER,EASTMINCOM ,EMCOC-2009-711-10 ,20 Sep 2010,"On 201305 Sep 2010, Scout Pltn, 73IB under 2LT CABALES PA encountered undet number of CTs believed to be members of Pltn Mazda, GF 71 SMRC under unknown CTL at vic Sitio Kisoy, Brgy Datal Anggas, Alabel, Saranggani Province. Firefight lasted for about ten (10) mins afterwhich, the enemy withdrew towards unknown direction. Negative casualty on the gov`t side while undet on the enemy side.Items Recovered / Loss: ",,,,,,Recovered 1 - One (1) Back pack,,TOG XI was alerted for possible CAS. Progress report to follow.,
11188,EASTMINCOM ,REGION XII,SARANGANI  ,ENCOUNTER,EASTMINCOM ,EMCOC-2109-714-10 ,21 Sep 2010,"On 21 Sep 2010, a Pltn (-) of 73IB, 10ID, PA under 2LT DIMACALE PA encountered undetermined number of CTs at vicinity Sitio Bual, Brgy Pag-asa, Alabel, Saranggani Province.  Firefight lasted for about five (5) minutes.Government Side:",,WIA Cpl Michael Todeno 754116  Cpl Ramel Garde 821800 ,,,,,,"a. One (1) Team from 73IB under Sgt Maquiling PA onboard one (1) Mk450 vehicle proceeded towards Sitio Buenavista, Brgy Pag-asa to reinforce the engaged troops. b. CAA PBs in the area were directed to secure the MSR for the evacuated of WIAs. c. Governor Dominguez of Sarangani Province dispatched one (1) ambulance to pick-up the WIAs.",
11200,EASTMINCOM ,REGION X,MISAMIS ORIENTAL  ,DISCOVERY OF ENEMY CAMP,"4ID, PA ",OPNS-2109-1786-2010 ,21 Sep 2010,"On 20 Sep 2010, one (1) squad of HHC, 8IB led by Cpl Bucio PA while traversing towards their objective discovered an enemy encampment at vicinity Bgy Impakibil, Claveria, Misamis Oriental. The encampment can accomodate MOL forty (40) CTs and was abandoned a week ago. Troops recovered one (1) jungle hammock and assorted personal belongings.Action Taken:",,,,,,,,Troops continue scouring the area.,
11203,EASTMINCOM ,CARAGA,AGUSAN DEL SUR ,ENCOUNTER,"AOC, PA ",SITREP # 90 ,22 Sep 2010,"On 220830 Sep 2010, combined troops of 42DRC led by 2LT OSCAR B DIMACALI PA, 26IB and CAAs of 23IB while conducting strike operation encountered MOL ten (10) CTs of GF-88 NCMRC at Bgy Valentina, Esperanza, Agusan del Sur. Firefight lasted for ten (10) minutes. After which the enemy withdrew towards different directions.Enemy Side:",Killed  One (1) BC (Name not reported)  ,,,Recovered 2 - M14 rifles (sn: 5652111 & 1418291),,,,"OA 220900 Sep 10, one (1) section of ACoy, 26IB led by 2LT ESILEN PA, jumped-off from ACoy, 26IB CP towards Duangan PB to block the withdrawing enemy forces, north of the encounter site. One (1) section of BCoy, 26IB, jumped-off from Policarpo PB and moved towards the southern part of the encounter site. All PBs in the boundary of San Luis and Esperanza, Agusan del Sur were directed to conduct checkpoints along the MSR.",
11212,EASTMINCOM ,REGION XI,COMPOSTELA VALLEY  ,HARASSMENT,EASTMINCOM ,EMCOC-2209-726-10 ,22 Sep 2010,"On 21 Sep 2010, The Pulahan post of JB Management at vic So Tinago, Brgy Mt Diwata, Monkayo, CVP was harassed by MOL 15 CTs of GF 20, SMRC under unknown leader. Firefight lasted for about 10 minutes after which the enemy withdrew towards NE direction heading to Tinago creek and Km 55 of same brgy.Other Details:",,,,,,,No casualty on the Pulahan side while undetermined on the enemy side.,"All PBs in Mt Diwata were allerted for possible enemy diversionary tactics, Meanwhile, Intel Operatives were also tasked to monitor enemy movement.",
11213,EASTMINCOM ,REGION XII,SARANGGANI ,DISCOVERY OF ENEMY CAMP,EASTMINCOM ,EMCOC-2209-725-10 ,22 Sep 2010,"Progress Report to Journal Item Nr: 11148 dtd 18 Sept 2010, re-discovery of enemy abandoned harboring site by Pltn of ACoy, 73IB under 2LT URSUA at vic Sitio Mangga, Brgy Datal Angas, Alabel, Saranggani on 171600 Sept 2010.Items Recovered / Loss: ",,,,,,Recovered 1 - Radio Receiver Kaide Brand Model KK-11,"On 211300 Sep 10, Commader 73IB directed 1LT FERNANDEZ PA, S3/Signal Officer of 73IB to conduct initial analysis and testing of the transistor radio. It was found out that the radio has the capability to receive frequency modulation 76 to 101 MHZ, medium wave 525 to 1610 KHZ and short wave 4.60 to 21.95 MHZ. The transistor radio has also a manual tuning dial that can monitor clearly the Harris HH Radio 5800V if set in plaintext mode (PT). If in the CT mode, voice transmission cannot be monitored but can monitor that a radio is transmitting same for the man pack Harris Radio.","a. CO,73IB, directed all operating troops to minimize transmission when approaching designated objectives and to strictly use CT mode for both Harris Radios. Further, directed Signal Officer to study frequencies to be programmed for Harris HH Radio outside the frequency range of the recovered transistor radio. b. The item will be turned-in to G2 and G6 for further analysis.",
11214,EASTMINCOM ,REGION XI,DAVAO DEL NORTE  ,SURRENDER,EASTMINCOM ,EMCOC-2209-727-10 ,22 Sep 2010,"On 221500 Sep 2010, a CT member and a Team Leader of Medical Staff of GF 2, SMRC surrendered to the troops of 72IB at vicinity Visayan Village, Tagum City. The surrender was facilitated by CPT SACLOT PA, BN S2 and 1LT CONEJOS PA, BN S7. Enemy Side:",Surrendered  Gemma Cambang Federico Luningning/Wating/Dimple,,,,,,,"On 1530H same day, subject was brought to H72IB for custodial debriefing.",
11217,EASTMINCOM ,CARAGA,SURIGAO DEL NORTE  ,DISCOVERY OF ENEMY CAMP,4ID ,EOPNS-2309-1792-2010 ,23 Sep 2010,"On 230930 Sep 2010, one (1) PLTN (-) of CCoy, under 2LT CADIL (INF) PA while conducting clearing/combat operations discovered an abandoned enemy harboring area at vicinity Brgy Magtangale, Malimono, Surigao del Norte that can accommodate MOL thirty (30) CTs.Items Recovered / Loss: ",,,,,,Recovered 1 - Empty short magazine for M16 rifle 1 - Talk and Text SIM pack and personal belongings,The troops immediately scoured the vicinity but found no indication of enemy presence. It was assessed to have been abandoned for almost a week. ,Troops continue scouring the area.,
11219,EASTMINCOM ,CARAGA,AGUSAN DEL SUR ,ENCOUNTER,"4ID, PA ",OPN-2309-1791-2010 ,23 Sep 2010,"Progress Report to Journal Item Nr: 11219 dtd 2010 dtd 23 Sept 2010, re-encounter of combined troops of 42DRC under 2LT OSCAR B DIMACALI (INF) PA, 26IB and CAAs of 32IB against MOL 10 CTs of GF - 88, NCMRC at vic 51P YK 02474909, Brgy Valentina, Esperanza, Agusan del Sur on 220830 Sept 2010. Items Recovered / Loss: ",,,,,,Recovered   - Personal items   - Documents 2 - Back pack with medical items,"a. On 221500H Sept 2010, one (1) section of BCoy, 26IB led by 2LT AMIR NARA PA link-up with engaged troops led by 2LT DIMACALI PA after which the troops continue scouring the vicinity of the encounter site. b. On 1700H same day, troops led by 2LT NARA PA, turned over the cadaver of the killed CT to the Brgy Captain Cerito A Aquino of Brgy Valentina, Esperanza, Agusan del Sur witnessed by several Brgy Officials and residents of the area. However, the Brgy Officials also failed to identify the CT killed in the encounter. After which, said troops proceeded towards Southwest portion of encounter site to occupy their harboring area. c. At about 1750H same day, pursuing troops of ACoy, 26IB, led by 2LT ESILEN (INF) PA arrived at vicinty 51P ZK 029506 with negative enemy contact.",,
11221,EASTMINCOM ,REGION XI,COMPOSTELA VALLEY  ,SURRENDER,EASTMINCOM ,EMCOC-2409-738-10 ,24 Sep 2010,"On 241643 Sep 2010, three (3) members of  27MRC under @ Isko voluntarily surrendered without FA`s to PDT TM 1/39IB under 2LT MORAL and Cpl Gayak at Purok 7 Bgy Andili, Mawab, CVPEnemy Side:",Surrendered  Junard Montes Levie  Renie Panganuron Kiagor  Jake Panganuron Renz,,,,,,"Named personalities are presently undergoing custodial debriefing at Andili PB, Brgy Andili, Mawab, CVP.",,
11223,EASTMINCOM ,REGION XI,DAVAO DEL SUR  ,SURRENDER,EASTMINCOM ,EMC-2409-742-10 ,24 Sep 2010,"On 241730 Sep 2010, a certain Eliseo Tada Y Moda @BIMBO, 40 yrs old, a resident of Brgy Upper Suyan, Malapatan, Saranggani Province and designated as ABE Team Leader, 1st Squad, Platoon MAZDA GF 71, FSMR under CTL @RONRON voluntarily surrendered without FA to PDT/39IB led by Cpl Rolando Lupiba PA, at Brgy Demoloc, Malita, Davao del Sur.Enemy Side:",Surrendered  Elisio Moda Bimbo,,,,,,"The subject was chilling, had high fever believed to be suffered from Malaria.",The surrenderee was immediately brought to Malita District Hospital for medical treatment. Inital debriefing is being conducted by operatives of 39IB.,
11234,EASTMINCOM ,REGION X,MISAMIS ORIENTAL  ,SURRENDER,EASTMINCOM ,EMCOC-2509-750-10 ,25 Sep 2010,"On 250800 Sep 2010, a certain Junior Adelina @ Ramon a resident of Bgy Kibanban, Balingasag, Misamis Oriental and member of Sqd 1, SYP (RAGU), GF 4B NCMRC under Tomas Tahoynon @ Poloy voluntarily surrendered without FAs to LT LICUDINE PA CO, 8IB through the efforts of intel operatives of said unit.Enemy Side:",Surrendered  Junior Adelina @ Ramon,,,,,,,"Subject is presently undergoing custodial debriefing at TCP HQs ACoy 23IB, Migbanday, Claveria, Misamis Oriental.",
11237,EASTMINCOM ,REGION XII,SULTAN KUDARAT  ,SURRENDER,EASTMINCOM ,EMCOC 2609 753 10 ,26 Sep 2010,"On 251530 Sep 2010, Gerson Amanda @ Jess,  former CT member of GF-76 FSMR voluntarily surrendered to the PDT of 27IB located at purok Motor, Bgy Lasak, Columbio, Sultan Kudarat. The surrender was facilitated by Kagawad Beltran Arandia and Bgy Chairman Marry Grace Lorez of said Bgy.Enemy Side:",Surrendered  Gerson Amanda @ Jess,,,,,,,"The subject was turned over to H27IB in Tupi, South Cotabato and is undergoing custodial debriefing and will be release after interrogation.",
11068,WESTMINCOM ,REGION IX,ZAMBOANGA DEL SUR  ,DISCOVERY OF ENEMY CAMP,1ID ,1DC-0809-1644-2010 ,08 Sep 2010,"On 081030 Sep 2010, one (1) Pltn of HHCoy, 10IB, PA under 1LT FRANCO SALVADOR M SUELTO (INF) PA while conducting combat operations at Sitio Tigpangi, Brgy Sominot, Kabasalan, Zamboanga Sibugay Province discovered enemy encampment  with estimated dimension of 100 meters long by 100 meter wide.  The encampment is surrounded with big trees and can accommodate MOL eighty (80) CTs. Items Recovered / Loss: ",,,,,,Recovered 1 - Claymore mines with 4 meters wire,Said encampment is believed to be a CT`s training camp due to the braided rattan three (3) inches diameter attached between two (2) trees assumingly used for commando crawl.,,
11072,WESTMINCOM ,REGION X,LANAO DEL NORTE  ,HARASSMENT,1ID ,1DC-0909-1702-2010 ,09 Sep 2010,"On 09 Sep 2010, undetermined number of unidentified men armed with HFAs harassed Pantaon Patrol Base, Pantaon, Munai, LDN. Firefight lasted for about ten (10) minutes after which enemy withdrew towards north direction.Action Taken:",,,,,,,,Troops under 2LT FIEDACAN (INF) PA are conducting clearing operation at the area.,
11073,WESTMINCOM ,REGION IX,ZAMBOANGA DEL SUR  ,ENCOUNTER,1D ,1DC--0909-   -2010 ,09 Sep 2010,"On 09 Sep 2010, One (1) Platoon of HHCo, 10IB under 1LT SUELTO (INF) PA, Acting Bn S2, while conducting combat operation, encountered undetermined number of CT`s under unknown CTL at vicinity GC 855735 Sitio Logdeck, Brgy New Tampilisan, Kabasalan, Zamboanga Sibugay. Government Side:",,KIA Pfc Marlon Nalalaray R ,,,,,,Troops Under 1LT SUELTO (INF) PA are still scouring the area.,
11113,WESTMINCOM ,REGION IX,ZAMBOANGA SIBUGAY  ,ENCOUNTER,1ID ,1DC 1309-1729-2010 ,13 Sep 2010,"On 131355 Sep 2010, 2nd Pltn from BCoy, 53IB composed of one (1) Officer, sixteen (16) EP and a CAA led by 2LT QUITORAS PA while on combat operation encountered MOL ten (10) CTs at vicinity Sitio Tigpangi, Brgy Peñaranda, Kabasalan, Zambaonga Sibugay Province. Firefight lasted for twenty (20) minutes, after which, the enemy withdrew towards Northeast direction.Enemy Side:",Captured    Names not reported  ,,,,,Recovered 2 - Rifle Grenades,No casualty was reported on the government side.,,
11118,WESTMINCOM ,REGION IX,ZAMBOANGA SIBUGAY  ,ENCOUNTER,WESTMINCOM ,WMC-1509-01 ,15 Sep 2010,"On 141350 Sep 2010, 2nd Pltn (-) of BCoy, 53IB, PA composed of one (1) Officer and seventeen (17) EPs and one (1) CAA under 2LT QUITORIAS PA while scouring at vicinity So Tigpangi, Brgy Peñaranda, Kabasalan, Zamboanga Sibugay Province encountered MOL twenty (20) CTs. Firefight lasted for about thirty (30) minutes after which the enemy withdrew towards unknown direction. No casualty was reported on both sides.Action Taken:",,,,,,,,Operating troops of 10IB and 44IB conducting blocking operation along possible enemy routes of withdrawal.,
11123,WESTMINCOM ,REGION IX,ZAMBOANGA SIBUGAY PROVINCE ,DISCOVERY OF ENEMY CAMP,"1ID, PA ",1DC-1409-1738-2010 ,14 Sep 2010,"On 121320 Sep 2010, One (1) Pltn(-) of BCoy, 53IB, under 2LT ROBIN V QUITORAS, while conducting combat clearing operation discovered an abandoned enemy camp at vicinity Sitio Tigpange, Brgy Peñaranda, Kabasalan, ZSP, that can accommodate MOL one hundred (100) persons.Other Details:",,,,,,,"a. Discovered and recovered at the said encampment were unfinished meals, clothes, used bandages, wound dressing and empty medicine bottles/foils. b. At about five hundred (500) meters from the said encampment the troops discovered a hastily abandoned CT harbor area.",Said troops established OP in the area.,
11133,WESTMINCOM ,REGION IX,ZAMBOANGA SIBUGAY ,ENCOUNTER,"1ID, PA ",1DC-1509-1747-2010 ,15 Sep 2010,"Progress Report to Journal Item Nr: 11113 dtd 14 Sept 2010, re-encounter of 2nd Pltn (-) BCoy of 53IB composed of one (1) Officer, sixteen (16) EP and one (1) CAA under 2LT QUITORAS against MOL ten (10) CTs while conducting combat operations at Sitio Tigpangi, Brgy Peñaranda, Kabasalan, ZSP on 131355H Sept 2010.Enemy Side:",Captured  Elmar A  Flores    Jenilyn F Flores    Ronel B Simacas  ,,,,,Recovered 1 - Bag medical kit w/ assorted medicine 14 - Sacks of palay 1  - Ltr Kerosene Gas 3 - pairs ruber boots 1 - pair of blanket 3 - pcs of pentel pen 2 - pcs ball pen   - Assorted kitchen utensils   - Subversive Documents   - Personal belongings,,"a. 2nd Pltn (-) BCoy conducted pursuit operations. b. Coordinated with the 10IB and 44IB to conduct blocking operations at GS 8772 and 8971 along possible enemy withdrawal routes. c. Ooa 141900 Sept 2010, the captured CTs were turned-over to PI SALVADOR GALVEZ, COP Kabasalan, ZSP PNP for blotter and filling of appropriate charges.",
11134,WESTMINCOM ,REGION X,MISAMIS OCCIDENTAL  ,SHOOTING,"1ID, PA ",1DC-1509-1746-2010 ,15 Sep 2010,"On 151530 Sep 2010, a certain CAA Lonie G Camayuman MO-A0073857, DS S2 55IB, of legal age, married a resident of River Side Lalud, DVC, Misamic Occidental was shot to death by two (2) unidentified gun men believed to be a member of CTM, SECOM JOJI,at Sitio Ninang Brgy Tuno, Don Victoriano Chiongbian, Misamis Occidental. The victim sustained gunshot wound on his head and the suspect fled the crime scene to unknown direction.Action Taken:",,,,,,,,"Ooa 151010 Sep 10, one (1) section, led by 2LT ESPARES left Coy Base Brgy Argao, Molave, ZDS and Tsg Gallebo Det Comdr Don Victoriano Chiongbian, Misamis Occidental to conduction rescue and pursuit operation. ",
11204,WESTMINCOM ,REGION IX,ZAMBOANGA SIBUGAY  ,ENCOUNTER,1ID ,1DC 2209-1774 ,22 Sep 2010,"On 22 Sep 2010, troops of ACoy & CCoy, 44IB composed of one (1) Officer and thirty one (31) EPs led by 2LT CAMILING PA while conducting combat operations encountered MOL 50 fully armed CTs at vicinity So Balubuan, Bgy Guinoman, Diplahan, ZSP. Firefight lasted for about one (1) hour and 15 mins. Negative casualty on the gov`t side.Enemy Side:",Killed  Body Count (BC)   Wounded  Unidentified    ,,,,,,"a. The troops noticed a group of CTs bringing HPFAs without bandoleers and wearing black long sleeves apparently to retrieve water along the creek. The troops immediately opened fire towards enemy location resulting to one (1) female killed (BC) and three (3) wounded. However, when the troops decided to pursue the armed CTs, the main group of the enemy which was concealed and occupying high ground positions opened fire to counter-attack advancing/pursuing troops. b. At about 1800H same day, troops occupied vicinity GC 886706 of the same brgy and immediately establish stronghold in the area.","OA 221700H Sep 10, LTC RILLERA PA, CO, 44IB continue monitoring and supervising the operations in the area.",
11207,WESTMINCOM ,REGION X,MISAMIS OCCIDENTAL  ,DISCOVERY OF ENEMY CAMP,WESTMINCOM ,WMC-2309-03 ,23 Sep 2010,"On 19 Sep 2010, Scout Platoon under LT ARADO PA while scouring near the creek lines boundary between Purok 2 and Purok 5 of Bgy Mamalad, Calamba, Misamis Occidental discovered an abandoned CT encampment that can accomodate MOL ten (10) persons.Action Taken:",,,,,,,,Troops continue the conduct of combat operations in the area.,
11208,WESTMINCOM ,REGION IX,ZAMBOANGA DEL NORTE  ,APPREHENSION,WESTMINCOM ,WMC 2309-02 ,23 Sep 2010,"On 21 Sep 2010, member of squad 1, RSDG1, ROC, WMPRC, and a resident of Sitio Makinaryas, Bgy Bunawan, Godod, ZDN was captured by CAA intel operatives of ECoy, 18IB. The captured CT was on board an assembled public utility truck, en-route towards Bgy Bunawan, Godod, ZDN. A concerned citizen inform CAA Dongon that the subject was on board the vehicle. The vehicle was not able to cross a spillway located in the same Bgy due to heavy flooding which resulted to the apprehension.Enemy Side:",Captured  Neilboy Esic Angoon Hector,,,,,,,"The CT is now under the custody of S2 sec of 10IB, 1ID, PA, Bgy Pob Leon Postigo, ZDN for custodial debriefing.",
11224,WESTMINCOM ,REGION IX,ZAMBOANGA SIBUGAY  ,DISCOVERY OF ENEMY CAMP,1ID ,1DC 2409-1792-2010 ,24 Sep 2010,"On 240815 Sep 2010, 2nd Pltn (-) B Coy, 53IB composed of one (1) officer, sisteen (16) EP and one (1) CAA under 2LT QUITARAS while conducting combat clearing operations discovered an abandoned CTM encampment at vic Brgy Lacnapan and Brgy Penaranda both of Kabasalan, ZSPAction Taken:",,,,,,,,Operating troops continued scouring the area to track and destroy enemy armed components while intel operatives intensified intel monitoring.,
11229,WESTMINCOM ,REGION IX,ZAMBOANGA SIBUGAY  ,RECOVERY OF WAR MATERIEL,1ID ,1DC 2409-7994-2010 ,24 Sep 2010,"On 241020 Sep 2010, 1st Pltn, CCo, 10IB compose of 18 EP under 2LT APITONG PA, while conducting combat opns and scouring the vic Brgy New Tampilisan, Kabasalan, ZSP discovered of trigger mechanism for M16, Garand and M14 rifles and four (4) gallons of rice hidden at vegetated area.Other Details:",,,,,,,Recovered items were believed to be owned by CTs who were recently engaged with the goverment troops.,Troops continued scouring the area and conducting OP operations.,
